number,value,params_colsample_bytree,params_compute_air_density,params_compute_air_density_moiust_air_correction,params_compute_wind_power_density,params_compute_wind_ramp,params_compute_wind_shear,params_dew_point_temperature,params_drop_raw_main_features,params_drop_raw_wind_features,params_encode_wind_direction,params_gust_factor,params_lags_choice,params_lags_target,params_learning_rate,params_max_depth,params_min_child_weight,params_n_estimators,params_precip_lags_choice,params_reg_alpha,params_reg_lambda,params_spatial_agg_method,params_subsample,params_turbulence_window,params_vapor_pressure,state
0,2747.9146238027865,0.6529811414612325,False,False,False,False,True,True,False,True,False,True,none,1.0,0.10174329769109886,7,4,804,none,4.105222466883905e-05,2.249145563643392e-08,mean,0.5234449984139349,6,True,COMPLETE
1,5807.174791304474,0.9603894119702392,False,True,False,False,True,True,True,False,True,True,large,12.0,0.29253755912432616,4,1,884,small,4.965246337135133e-07,3.272415674968507e-08,mean,0.8779926420876829,6,False,COMPLETE
2,3989.749203002931,0.645724015636135,False,False,True,True,False,True,True,True,True,False,none,6.0,0.08039712912142645,5,2,548,small,0.0002381990114000373,2.5436722914302972e-05,max,0.5848209315334962,0,True,COMPLETE
3,5895.604324570327,0.6963648831033007,True,True,False,False,False,False,True,False,False,True,small,6.0,0.2222342197442383,3,5,464,small,0.0019087424305611028,0.47798762768588493,max,0.6370652635504812,0,False,COMPLETE
4,2639.2429460379612,0.8781806745129839,False,False,False,False,False,False,True,False,True,True,small,6.0,0.06057225614856543,6,7,402,none,1.5929109833136725e-08,5.661473879497617e-07,distance_capacity,0.7889451281283855,2,False,COMPLETE
5,2519.887507313996,0.7684222375693439,True,True,False,True,True,False,True,True,False,True,none,1.0,0.03313324267042506,6,9,669,small,0.00010643379358374562,0.0035902943331488388,distance_capacity,0.6657808101158915,6,True,COMPLETE
6,3302.483131318098,0.8093177158810527,True,False,False,True,False,True,False,False,True,True,small,12.0,0.10429619012278965,8,2,591,large,0.011457786469330152,0.00879479133817777,idw,0.9287780411373217,2,False,COMPLETE
7,3752.729847512345,0.5342618083133857,False,False,True,False,True,False,False,False,False,False,large,6.0,0.03893864306110324,6,1,441,none,0.16757106943188335,0.004676759949652633,distance_capacity,0.9549532440193019,6,True,COMPLETE
8,2223.4120709118815,0.5502377786174971,True,False,False,True,True,False,True,True,True,False,large,6.0,0.12881228830259528,8,3,405,none,0.0069641487897926955,0.005261394894354591,None,0.7695034578850775,0,True,COMPLETE
9,2337.9257024112685,0.7142071188487411,False,False,True,True,True,True,False,True,True,False,small,,0.018854240152700853,7,8,926,none,0.7697778101796837,9.06096942818657e-06,max,0.664357214763972,0,True,COMPLETE
10,1375.941746267582,0.5056239701371128,True,True,True,True,True,False,True,True,True,False,large,,0.16818149704027616,10,4,317,large,2.3931529663266893e-06,0.98859548869799,None,0.790135308417698,0,True,COMPLETE
11,1362.3086098898561,0.5088576770365993,True,True,True,True,True,False,True,True,True,False,large,,0.16395170675280388,10,4,307,large,2.42493671922642e-06,0.6919748539627407,None,0.809921733791654,0,True,COMPLETE
12,1325.9787172983304,0.5128027269633806,True,True,True,True,True,False,True,True,True,False,large,,0.18076442116048522,10,6,307,large,1.9441013298998626e-06,0.8604293480161692,None,0.8524875144276206,0,True,COMPLETE
13,1614.0389608631365,0.5936491565459885,True,True,True,True,True,False,True,True,True,False,large,,0.18237644745887507,10,6,316,large,8.482051357843395e-07,0.06071651355846132,distance_n_turbines,0.877121479231077,0,True,COMPLETE
14,2059.1735840144174,0.5930681964663924,True,True,True,True,True,False,True,True,True,False,large,,0.2966243257611421,9,10,682,large,2.021658379855966e-08,0.00031342426256234423,capacity,0.8553706358702474,0,True,COMPLETE
15,1315.675663589445,0.5035188227342907,True,True,True,True,True,False,True,True,True,False,large,,0.06315888093108425,9,6,304,large,7.087446490238177e-06,0.11038395017941112,None,0.7318753221766472,0,True,COMPLETE
16,1283.6325050684275,0.6131534201005755,True,True,True,True,True,False,True,True,True,False,large,,0.010422378119870622,9,6,497,large,7.979391266816475e-06,0.06304300452549173,None,0.9996259705265362,2,True,COMPLETE
17,1287.9157932637615,0.6044004467698444,True,True,True,True,True,False,True,True,True,False,large,,0.012908843181288408,8,7,519,large,3.921904337514086e-05,0.0003205685714864012,None,0.996470491863132,2,True,COMPLETE
18,2017.4075192984328,0.6299393093721821,True,True,True,True,False,False,False,True,False,False,large,,0.01051588442893062,8,8,533,large,2.2311225537532186e-05,0.0002082668507220922,capacity,0.9928352421759201,2,False,COMPLETE
19,2860.2794835139716,0.8034476764833794,True,True,True,True,True,False,True,True,True,False,none,12.0,0.010744868239093033,9,7,615,large,1.6890870295550764e-07,2.1536230316572288e-06,distance_n_turbines,0.99999938519657,2,True,COMPLETE
20,2460.2955505060327,0.6978056206110272,True,True,True,True,True,False,True,True,True,False,large,1.0,0.0186411918522514,8,8,740,large,0.0005223385028436495,0.0004604441399503145,idw,0.9283294955447197,2,True,COMPLETE
21,1294.4754131239927,0.5869438993876216,True,True,True,True,True,False,True,True,True,False,large,,0.017396714812540973,9,5,499,large,2.1929604943560177e-05,0.05286428009875307,None,0.724999852446126,2,True,COMPLETE
22,1294.9468433641684,0.5883717358524445,True,True,True,True,True,False,True,True,True,False,large,,0.01598262145184908,9,5,510,large,2.2802130968433912e-05,0.030750910796455557,None,0.7307293891655566,2,True,COMPLETE
23,1285.8836674251277,0.5774067175405551,True,True,True,True,True,False,True,True,True,False,large,,0.014236419956243175,7,7,484,large,1.3516996419483112e-07,0.001391487587712527,None,0.9489592419863203,2,True,COMPLETE
24,1293.3612594823924,0.664963435137672,True,True,True,True,True,False,True,True,True,False,large,,0.027237425809823856,7,7,585,large,1.442941182519374e-07,0.0013765989047962166,None,0.9546845198465631,2,True,COMPLETE
25,1258.9288512790965,0.5700201819077056,True,True,True,True,True,False,True,True,True,False,large,,0.013079718304860783,5,9,391,large,7.975945494644002e-08,0.0009733690561637337,None,0.9098829447271899,2,True,COMPLETE
26,1308.2242582846418,0.5592353155375372,True,True,True,False,False,True,False,False,False,False,large,,0.024728759089022372,5,10,408,large,7.490069237218035e-08,8.080397291330861e-05,None,0.9081831371208657,2,False,COMPLETE
27,1256.8436409977073,0.5594644493588441,True,True,True,True,True,False,True,True,True,False,large,,0.013671680832214966,5,9,381,large,5.938885189111592e-08,0.0016447437968149122,None,0.9537876773542723,2,True,COMPLETE
28,2291.1167570620614,0.6243128322532147,True,True,True,True,True,False,True,True,True,False,none,12.0,0.02421911583491142,4,9,373,large,1.1503797071888406e-08,0.01875523872516694,capacity,0.8280168294853688,2,True,COMPLETE
29,1633.8412832053127,0.6848719175719657,False,True,True,False,True,True,False,True,False,True,small,1.0,0.010162089710168052,5,9,364,small,4.5975282644536483e-08,6.342239769240173e-05,idw,0.5055751612507012,2,True,COMPLETE
